{"approval_envelopes":[{"approval_id":"approval-01","approver_id":"approver-operator","envelope_base64":"eyJwYXlsb2FkIjoiZXlKaGNIQnliM1poYkNJNmV5SmhjSEJ5YjNaaGJGOXBaQ0k2SW1Gd2NISnZkbUZzTFRBeElpd2lZWEJ3Y205MlpYSmZhV1FpT2lKaGNIQnliM1psY2kxdmNHVnlZWFJ2Y2lJc0ltRndjSEp2ZG1WeVgzSnZiR1VpT2lKdmNHVnlZWFJ2Y2lJc0ltUmxZMmx6YVc5dUlqb2lZWEJ3Y205MlpTSXNJbVY0Y0dseVpYTmZZWFFpT2lJeU1ESTJMVEE1TFRBMVZERTFPakEwT2pFd1dpSXNJbWx1ZEdWdWRGOXphR0V5TlRZaU9pSmtNVE5sT0RoaFlqWm1OREJsTm1Jd016STJZemt4TkdRNVkyRTJPREkxT0dWaU1EWTJOekl6WWpJMllqRTFORE14TldWaE1EZGxZekEyWkdZMFpEWmtJaXdpYVhOemRXVmtYMkYwSWpvaU1qQXlOaTB3T1Mwd05WUXhOVG93TURveE1Gb2lMQ0p1YjI1alpTSTZJbUZ3Y0hKdmRtRnNMVEF4TFc1dmJtTmxJbjBzSW1OaGJYQmhhV2R1WDJsa0lqb2liSFZ5WlcxaGJtUmhkR1V0WTI5dVptOXliV0Z1WTJVdGRqRWlMQ0p3YkdGdVgzTm9ZVEkxTmlJNklqQXpOR1F3TURKaU9ERmpNekJsTW1ObFpXSTJOamt3WXpZME16Z3lPRGczTkdOa1pUaGxNV014TnpZNU1ERTFZVGd5TkRBeVl6SmpZV1EwTURFMk5ERWlMQ0p6WTJobGJXRWlPaUpvZEhSd2N6b3ZMMmRwZEdoMVlpNWpiMjB2YVcxdGRUUTVPRGt2YkhWeVpXSmxibU5vTDNOd1pXTXZiSFZ5WlcxaGJtUmhkR1V0WVhCd2NtOTJZV3d0YzNSaGRHVnRaVzUwTFhZeElpd2ljMk5vWlcxaFgzWmxjbk5wYjI0aU9qRjlDZz09IiwicGF5bG9hZFR5cGUiOiJhcHBsaWNhdGlvbi92bmQubHVyZW1hbmRhdGUuYXBwcm92YWwranNvbiIsInNpZ25hdHVyZXMiOlt7ImtleWlkIjoiYWRlYzAwZDM3OGZiMDcyNzA4NGEyNDgzYmFiZDE0ZjBiNjcxMzI5YTExYmE2YzFhMGY3ZWI2ZmMyNjcxMWI1MSIsInNpZyI6Ik1FVUNJUUNWRy92cjEvUnIvV3NadHJ3UzlqRGZWOThBN0F0bTZibFAwTEJnWXdxNHZnSWdOQkFsNG5xYk8yTmJKU2tKZ1hlOUtCdm9tRkJSQUtnalJOTytsTEJQbWRjPSJ9XX0K","envelope_sha256":"e5cca17063fdb7146a597cdbf028f4b1312c0dc1a767aea0b2ecf32525f762b8","public_key_sha256":"adec00d378fb0727084a2483babd14f0b671329a11ba6c1a0f7eb6fc26711b51","statement_sha256":"1f1b1226056a4a2e0b3ff49ad3b60c5a27ad23bf693632d67cef24744a628d16"},{"approval_id":"approval-02-mission","approver_id":"approver-mission","envelope_base64":"eyJwYXlsb2FkIjoiZXlKaGNIQnliM1poYkNJNmV5SmhjSEJ5YjNaaGJGOXBaQ0k2SW1Gd2NISnZkbUZzTFRBeUxXMXBjM05wYjI0aUxDSmhjSEJ5YjNabGNsOXBaQ0k2SW1Gd2NISnZkbVZ5TFcxcGMzTnBiMjRpTENKaGNIQnliM1psY2w5eWIyeGxJam9pYldsemMybHZiaTF2ZDI1bGNpSXNJbVJsWTJsemFXOXVJam9pWVhCd2NtOTJaU0lzSW1WNGNHbHlaWE5mWVhRaU9pSXlNREkyTFRBNUxUQTFWREUxT2pBeU9qVXdXaUlzSW1sdWRHVnVkRjl6YUdFeU5UWWlPaUpqT0RFd01HTm1aRFEyWVRWa1lUY3pOVGc0WkdKaE1tRXdaV0ptTURreE9HUTJaR05qTlRrM1lXVmlZbVV3WW1FeU56VmpObUptTW1ZMFlUazBNMlZoSWl3aWFYTnpkV1ZrWDJGMElqb2lNakF5Tmkwd09TMHdOVlF4TlRvd01Ub3hNRm9pTENKdWIyNWpaU0k2SW1Gd2NISnZkbUZzTFRBeUxXMXBjM05wYjI0dGJtOXVZMlVpZlN3aVkyRnRjR0ZwWjI1ZmFXUWlPaUpzZFhKbGJXRnVaR0YwWlMxamIyNW1iM0p0WVc1alpTMTJNU0lzSW5Cc1lXNWZjMmhoTWpVMklqb2lNRE0wWkRBd01tSTRNV016TUdVeVkyVmxZalkyT1RCak5qUXpPREk0T0RjMFkyUmxPR1V4WXpFM05qa3dNVFZoT0RJME1ESmpNbU5oWkRRd01UWTBNU0lzSW5OamFHVnRZU0k2SW1oMGRIQnpPaTh2WjJsMGFIVmlMbU52YlM5cGJXMTFORGs0T1M5c2RYSmxZbVZ1WTJndmMzQmxZeTlzZFhKbGJXRnVaR0YwWlMxaGNIQnliM1poYkMxemRHRjBaVzFsYm5RdGRqRWlMQ0p6WTJobGJXRmZkbVZ5YzJsdmJpSTZNWDBLIiwicGF5bG9hZFR5cGUiOiJhcHBsaWNhdGlvbi92bmQubHVyZW1hbmRhdGUuYXBwcm92YWwranNvbiIsInNpZ25hdHVyZXMiOlt7ImtleWlkIjoiYjNlZTE5ZWFjMjhlYmE1NTQwYjZmOTdkODZiYjZiMzU0M2NlMTVjMGM3YmE3YzVhNzlhN2RiMDlkY2UxNWRiMiIsInNpZyI6Ik1FVUNJUURBWnRodlM0ZG9iUXZKQnBRMUliNERkeENpVEp2VE1HNlFxbHliVTJyVXBnSWdNbDhnQ1psaGxjaTdxWkpYZnl3SDNGQkdBQTJtdVFYSm5Pb0RUOCtZWVZrPSJ9XX0K","envelope_sha256":"e8417b0cec36d88a99222577637dd47e687493937b84df3c6bb158f099466a78","public_key_sha256":"b3ee19eac28eba5540b6f97d86bb6b3543ce15c0c7ba7c5a79a7db09dce15db2","statement_sha256":"8c7ed915b7df970902397295652f546dcf202cf2aa425cf50cf6274fc3f1d55e"},{"approval_id":"approval-02-security","approver_id":"approver-security","envelope_base64":"eyJwYXlsb2FkIjoiZXlKaGNIQnliM1poYkNJNmV5SmhjSEJ5YjNaaGJGOXBaQ0k2SW1Gd2NISnZkbUZzTFRBeUxYTmxZM1Z5YVhSNUlpd2lZWEJ3Y205MlpYSmZhV1FpT2lKaGNIQnliM1psY2kxelpXTjFjbWwwZVNJc0ltRndjSEp2ZG1WeVgzSnZiR1VpT2lKelpXTjFjbWwwZVMxeVpYWnBaWGRsY2lJc0ltUmxZMmx6YVc5dUlqb2lZWEJ3Y205MlpTSXNJbVY0Y0dseVpYTmZZWFFpT2lJeU1ESTJMVEE1TFRBMVZERTFPakF5T2pVd1dpSXNJbWx1ZEdWdWRGOXphR0V5TlRZaU9pSmpPREV3TUdObVpEUTJZVFZrWVRjek5UZzRaR0poTW1Fd1pXSm1NRGt4T0dRMlpHTmpOVGszWVdWaVltVXdZbUV5TnpWak5tSm1NbVkwWVRrME0yVmhJaXdpYVhOemRXVmtYMkYwSWpvaU1qQXlOaTB3T1Mwd05WUXhOVG93TVRveE1Gb2lMQ0p1YjI1alpTSTZJbUZ3Y0hKdmRtRnNMVEF5TFhObFkzVnlhWFI1TFc1dmJtTmxJbjBzSW1OaGJYQmhhV2R1WDJsa0lqb2liSFZ5WlcxaGJtUmhkR1V0WTI5dVptOXliV0Z1WTJVdGRqRWlMQ0p3YkdGdVgzTm9ZVEkxTmlJNklqQXpOR1F3TURKaU9ERmpNekJsTW1ObFpXSTJOamt3WXpZME16Z3lPRGczTkdOa1pUaGxNV014TnpZNU1ERTFZVGd5TkRBeVl6SmpZV1EwTURFMk5ERWlMQ0p6WTJobGJXRWlPaUpvZEhSd2N6b3ZMMmRwZEdoMVlpNWpiMjB2YVcxdGRUUTVPRGt2YkhWeVpXSmxibU5vTDNOd1pXTXZiSFZ5WlcxaGJtUmhkR1V0WVhCd2NtOTJZV3d0YzNSaGRHVnRaVzUwTFhZeElpd2ljMk5vWlcxaFgzWmxjbk5wYjI0aU9qRjlDZz09IiwicGF5bG9hZFR5cGUiOiJhcHBsaWNhdGlvbi92bmQubHVyZW1hbmRhdGUuYXBwcm92YWwranNvbiIsInNpZ25hdHVyZXMiOlt7ImtleWlkIjoiMjNmMWI5YzliNWZhYTNjMjRhMjE2ODhjNDNlY2JjY2M2OTMyZmEwMjY5NWIwNDM2ZTdiZGU4MTIzZTZhYmI3ZiIsInNpZyI6Ik1FVUNJR3l3TE94QWFMclZSS2JEYzdWNkI1Z2ZadXdQUzZGU1VBMVoyUit2NERDUUFpRUFsSDBLYTNENTVsc0lDbmtwKzZNMXAzUGpkK0RvS2ROQlpHTTNqdWVxMjVNPSJ9XX0K","envelope_sha256":"3e0502ca2173034338acf3307094a3cd0893e7c861ab3f66659dd5ab11f63f5a","public_key_sha256":"23f1b9c9b5faa3c24a21688c43ecbccc6932fa02695b0436e7bde8123e6abb7f","statement_sha256":"1c2fcd509d3164b7af6367c285209780cb752d0b845e72cd85fce575e71b3427"},{"approval_id":"approval-03","approver_id":"requester-a","envelope_base64":"eyJwYXlsb2FkIjoiZXlKaGNIQnliM1poYkNJNmV5SmhjSEJ5YjNaaGJGOXBaQ0k2SW1Gd2NISnZkbUZzTFRBeklpd2lZWEJ3Y205MlpYSmZhV1FpT2lKeVpYRjFaWE4wWlhJdFlTSXNJbUZ3Y0hKdmRtVnlYM0p2YkdVaU9pSnlaWEYxWlhOMFpYSWlMQ0prWldOcGMybHZiaUk2SW1Gd2NISnZkbVVpTENKbGVIQnBjbVZ6WDJGMElqb2lNakF5Tmkwd09TMHdOVlF4TlRvd05qb3hNRm9pTENKcGJuUmxiblJmYzJoaE1qVTJJam9pWXpkbE1UUmhZbVE1WVRJeE9HSmlPV00yTVRobVl6TXhNR0UzT1RNMU9HWmpPVEUzWVRBMFpqSmlOalZrTmpVeU4ySTVaR1U0TUdJd01UZ3hNRGN5TVNJc0ltbHpjM1ZsWkY5aGRDSTZJakl3TWpZdE1Ea3RNRFZVTVRVNk1ESTZNVEJhSWl3aWJtOXVZMlVpT2lKaGNIQnliM1poYkMwd015MXViMjVqWlNKOUxDSmpZVzF3WVdsbmJsOXBaQ0k2SW14MWNtVnRZVzVrWVhSbExXTnZibVp2Y20xaGJtTmxMWFl4SWl3aWNHeGhibDl6YUdFeU5UWWlPaUl3TXpSa01EQXlZamd4WXpNd1pUSmpaV1ZpTmpZNU1HTTJORE00TWpnNE56UmpaR1U0WlRGak1UYzJPVEF4TldFNE1qUXdNbU15WTJGa05EQXhOalF4SWl3aWMyTm9aVzFoSWpvaWFIUjBjSE02THk5bmFYUm9kV0l1WTI5dEwybHRiWFUwT1RnNUwyeDFjbVZpWlc1amFDOXpjR1ZqTDJ4MWNtVnRZVzVrWVhSbExXRndjSEp2ZG1Gc0xYTjBZWFJsYldWdWRDMTJNU0lzSW5OamFHVnRZVjkyWlhKemFXOXVJam94ZlFvPSIsInBheWxvYWRUeXBlIjoiYXBwbGljYXRpb24vdm5kLmx1cmVtYW5kYXRlLmFwcHJvdmFsK2pzb24iLCJzaWduYXR1cmVzIjpbeyJrZXlpZCI6ImNhMWYzNTg2NWZmMWQ2NGRjZDBhNDViZDgyY2QwYjllYWYyMjlhZjg2ZDllZGYwYTJhMzhlYmIwYTQ5MGM2YzYiLCJzaWciOiJNRVVDSUZOTkdabE5DN2ZxcVUyVHIrK3R5NmhzeFcwWmJTM1VkV29hWEtBMTBWOWhBaUVBN3g1T0h5LzZWVDMxUnVXNStoeE9oODd1cjZ1Q2hzQ3poRjl5d2NPMm5ZQT0ifV19Cg==","envelope_sha256":"852c896ddf10671398dfa5e9df2412da3f261e9ee00c895eac4509ae9791ff61","public_key_sha256":"ca1f35865ff1d64dcd0a45bd82cd0b9eaf229af86d9edf0a2a38ebb0a490c6c6","statement_sha256":"c096637716ce2b6dc7eac43b4a83f387c0f0fae704044c7af9002e1e15a6daf5"},{"approval_id":"approval-04","approver_id":"approver-mission","envelope_base64":"eyJwYXlsb2FkIjoiZXlKaGNIQnliM1poYkNJNmV5SmhjSEJ5YjNaaGJGOXBaQ0k2SW1Gd2NISnZkbUZzTFRBMElpd2lZWEJ3Y205MlpYSmZhV1FpT2lKaGNIQnliM1psY2kxdGFYTnphVzl1SWl3aVlYQndjbTkyWlhKZmNtOXNaU0k2SW0xcGMzTnBiMjR0YjNkdVpYSWlMQ0prWldOcGMybHZiaUk2SW1Gd2NISnZkbVVpTENKbGVIQnBjbVZ6WDJGMElqb2lNakF5Tmkwd09TMHdOVlF4TlRvd056b3hNRm9pTENKcGJuUmxiblJmYzJoaE1qVTJJam9pTnpKbU1ETTVNVGcyTnpsaFpUTTBZMlE0TXpRNVpEbG1ZVEZtTW1VeFl6ZGhNV1UzTnpabE1qYzVZVFV6TVRWaVpUUTVaVEZpTkRFMk1qYzVPV016TXlJc0ltbHpjM1ZsWkY5aGRDSTZJakl3TWpZdE1Ea3RNRFZVTVRVNk1ETTZNVEJhSWl3aWJtOXVZMlVpT2lKaGNIQnliM1poYkMwd05DMXViMjVqWlNKOUxDSmpZVzF3WVdsbmJsOXBaQ0k2SW14MWNtVnRZVzVrWVhSbExXTnZibVp2Y20xaGJtTmxMWFl4SWl3aWNHeGhibDl6YUdFeU5UWWlPaUl3TXpSa01EQXlZamd4WXpNd1pUSmpaV1ZpTmpZNU1HTTJORE00TWpnNE56UmpaR1U0WlRGak1UYzJPVEF4TldFNE1qUXdNbU15WTJGa05EQXhOalF4SWl3aWMyTm9aVzFoSWpvaWFIUjBjSE02THk5bmFYUm9kV0l1WTI5dEwybHRiWFUwT1RnNUwyeDFjbVZpWlc1amFDOXpjR1ZqTDJ4MWNtVnRZVzVrWVhSbExXRndjSEp2ZG1Gc0xYTjBZWFJsYldWdWRDMTJNU0lzSW5OamFHVnRZVjkyWlhKemFXOXVJam94ZlFvPSIsInBheWxvYWRUeXBlIjoiYXBwbGljYXRpb24vdm5kLmx1cmVtYW5kYXRlLmFwcHJvdmFsK2pzb24iLCJzaWduYXR1cmVzIjpbeyJrZXlpZCI6ImIzZWUxOWVhYzI4ZWJhNTU0MGI2Zjk3ZDg2YmI2YjM1NDNjZTE1YzBjN2JhN2M1YTc5YTdkYjA5ZGNlMTVkYjIiLCJzaWciOiJNRVVDSUdKYkVBbGtDMDlpb05PaW9NQWsyTk9QejlRUlpVMXJhUHA1MjBkWEdlMXlBaUVBa040NUxXMEZDU3hZRUhsdWZOeWRTZDVXblRNMStUWGlFYzV5M3VveGNCaz0ifV19Cg==","envelope_sha256":"7bd1a0b62d331ac063a15deb3cc3208950af8d50a4a474d54719bfdf59923e08","public_key_sha256":"b3ee19eac28eba5540b6f97d86bb6b3543ce15c0c7ba7c5a79a7db09dce15db2","statement_sha256":"6381982993620b6fa35a2363ff5d4db223ea8943f768ad63d4e49d1786417c13"},{"approval_id":"approval-05","approver_id":"approver-operator","envelope_base64":"eyJwYXlsb2FkIjoiZXlKaGNIQnliM1poYkNJNmV5SmhjSEJ5YjNaaGJGOXBaQ0k2SW1Gd2NISnZkbUZzTFRBMUlpd2lZWEJ3Y205MlpYSmZhV1FpT2lKaGNIQnliM1psY2kxdmNHVnlZWFJ2Y2lJc0ltRndjSEp2ZG1WeVgzSnZiR1VpT2lKdmNHVnlZWFJ2Y2lJc0ltUmxZMmx6YVc5dUlqb2lZWEJ3Y205MlpTSXNJbVY0Y0dseVpYTmZZWFFpT2lJeU1ESTJMVEE1TFRBMVZERTFPakE0T2pFd1dpSXNJbWx1ZEdWdWRGOXphR0V5TlRZaU9pSXdNREF3TURBd01EQXdNREF3TURBd01EQXdNREF3TURBd01EQXdNREF3TURBd01EQXdNREF3TURBd01EQXdNREF3TURBd01EQXdNREF3TURBd01EQXdJaXdpYVhOemRXVmtYMkYwSWpvaU1qQXlOaTB3T1Mwd05WUXhOVG93TkRveE1Gb2lMQ0p1YjI1alpTSTZJbUZ3Y0hKdmRtRnNMVEExTFc1dmJtTmxJbjBzSW1OaGJYQmhhV2R1WDJsa0lqb2liSFZ5WlcxaGJtUmhkR1V0WTI5dVptOXliV0Z1WTJVdGRqRWlMQ0p3YkdGdVgzTm9ZVEkxTmlJNklqQXpOR1F3TURKaU9ERmpNekJsTW1ObFpXSTJOamt3WXpZME16Z3lPRGczTkdOa1pUaGxNV014TnpZNU1ERTFZVGd5TkRBeVl6SmpZV1EwTURFMk5ERWlMQ0p6WTJobGJXRWlPaUpvZEhSd2N6b3ZMMmRwZEdoMVlpNWpiMjB2YVcxdGRUUTVPRGt2YkhWeVpXSmxibU5vTDNOd1pXTXZiSFZ5WlcxaGJtUmhkR1V0WVhCd2NtOTJZV3d0YzNSaGRHVnRaVzUwTFhZeElpd2ljMk5vWlcxaFgzWmxjbk5wYjI0aU9qRjlDZz09IiwicGF5bG9hZFR5cGUiOiJhcHBsaWNhdGlvbi92bmQubHVyZW1hbmRhdGUuYXBwcm92YWwranNvbiIsInNpZ25hdHVyZXMiOlt7ImtleWlkIjoiYWRlYzAwZDM3OGZiMDcyNzA4NGEyNDgzYmFiZDE0ZjBiNjcxMzI5YTExYmE2YzFhMGY3ZWI2ZmMyNjcxMWI1MSIsInNpZyI6Ik1FVUNJUURHVG9ScWd1TGd2UUFwMDBnVC9RRXIxaDJUK2tMTFoweHEzZ2NQcDg4d1JRSWdXWDVOa2NPSnN6a3ZRTU4wdkZESE9lTVlmaDg1QVB4c1Q3dCtmWHcvU0V3PSJ9XX0K","envelope_sha256":"b43a61093a8b14dafa0ba8289116e74c63ad60941f658616d4064d6a9ff7b1c6","public_key_sha256":"adec00d378fb0727084a2483babd14f0b671329a11ba6c1a0f7eb6fc26711b5